{
  "$schema": "https://json-schema.org/draft/2020-12/schema",
  "$id": "https://design-drafts.dev/schemas/draft-manifest.schema.json",
  "title": "DraftManifest",
  "description": "Machine-readable description of a design draft. Lives at the root of a draft directory as draft.config.json. Themes, layouts, pages, and variants are all distinct HTML files; the manifest is a routing table consumed by the toolbar, the index site, and the annotate package.",
  "type": "object",
  "required": ["name", "createdAt"],
  "additionalProperties": false,
  "properties": {
    "$schema": {
      "type": "string",
      "description": "Optional JSON Schema reference for editor tooling."
    },
    "name": {
      "type": "string",
      "minLength": 1,
      "description": "Human-readable label for the draft."
    },
    "description": {
      "type": "string",
      "description": "Longer explanation of what the draft is exploring."
    },
    "pages": {
      "type": "array",
      "description": "Distinct pages (e.g. landing, pricing) that exist in this draft. Each path points at an HTML file relative to the draft root.",
      "items": { "$ref": "#/$defs/PageEntry" }
    },
    "variants": {
      "type": "array",
      "description": "Alternative HTML files representing different variants of the design.",
      "items": { "$ref": "#/$defs/NamedEntry" }
    },
    "themes": {
      "type": "array",
      "description": "Theme variations, each as a distinct HTML file.",
      "items": { "$ref": "#/$defs/NamedEntry" }
    },
    "layouts": {
      "type": "array",
      "description": "Layout variations, each as a distinct HTML file.",
      "items": { "$ref": "#/$defs/NamedEntry" }
    },
    "prompt": {
      "type": "string",
      "description": "The brief that generated the draft. Free text, or a path reference like 'references/brief.md'."
    },
    "source": {
      "type": "object",
      "description": "Snapshot of where the draft came from.",
      "additionalProperties": false,
      "properties": {
        "sha": {
          "type": "string",
          "minLength": 1,
          "description": "Git commit SHA the draft was generated from."
        },
        "repo": {
          "type": "string",
          "minLength": 1,
          "description": "Repository identifier (e.g. owner/name or URL)."
        },
        "author": {
          "type": "string",
          "minLength": 1,
          "description": "Author or agent that produced the draft."
        }
      }
    },
    "createdAt": {
      "type": "string",
      "format": "date-time",
      "description": "ISO 8601 timestamp marking when the draft was generated."
    }
  },
  "$defs": {
    "RelativeHtmlPath": {
      "type": "string",
      "minLength": 1,
      "description": "Path to an HTML file, relative to the draft root. Must not be empty or absolute and must not escape the draft root.",
      "pattern": "^(?!\\/)(?!.*\\.\\.(\\/|$)).+$"
    },
    "NamedEntry": {
      "type": "object",
      "required": ["name", "path"],
      "additionalProperties": false,
      "properties": {
        "name": {
          "type": "string",
          "minLength": 1,
          "description": "Human-readable label for the entry."
        },
        "path": { "$ref": "#/$defs/RelativeHtmlPath" },
        "description": {
          "type": "string",
          "description": "Optional longer description shown in switchers."
        }
      }
    },
    "PageEntry": {
      "type": "object",
      "required": ["name", "path"],
      "additionalProperties": false,
      "properties": {
        "name": {
          "type": "string",
          "minLength": 1,
          "description": "Human-readable label for the page."
        },
        "path": { "$ref": "#/$defs/RelativeHtmlPath" }
      }
    }
  }
}
